{"authoritative":false,"authority_required":true,"edges":[{"from":"RC12-F01","status":"candidate","to":"prd/PRODUCT.md","type":"maps_to"},{"from":"RC12-F05","status":"candidate","to":"ADR-0023","type":"maps_to"},{"from":"RC12-F05","status":"candidate","to":"TSG-006","type":"maps_to"},{"from":"RC12-F17","status":"candidate","to":"ADR-0009","type":"maps_to"},{"from":"RC12-F19","status":"candidate","to":"review-12-m166-m176-proposal","type":"maps_to"}],"events":[{"actor_class":"human","at":"2026-08-12T05:56:35Z","event_id":"RC12-E001","event_type":"packet_registered","rationale":"Register immutable review-12 source for non-authoritative delta fixture","source_revision":"1092ef435947d74080818f69dd08dbb27bfb8f9c"}],"findings":[{"candidate_targets":[{"id":"prd/PRODUCT.md","surface":"product"},{"id":"prd/REQUIREMENTS.md","surface":"requirement"}],"concern_class":"docs","disposition_status":"open","execution_status":"unplanned","finding_id":"RC12-F01","kind":"gap","non_claims":["Docs existence only; not product readiness","Not lifecycle promotion of PRODUCT/REQUIREMENTS beyond proposed","Non-authoritative review projection"],"normalization_status":"source_verified","required_proof_class":"docs","reviewer_severity":"medium","source_spans":[{"heading":"## Закрыто или существенно улучшено","line_end":56,"line_start":15,"path":"doc/review/review-12-08-2026.md","quote_sha256":"1fddfb55822d13e7733517198721a25d8ab2fba831ac9915eac2dda9b3583518"}],"summary":"Modern PRODUCT.md and REQUIREMENTS.md now exist after prior PRD gap","verification_status":"unverified"},{"candidate_targets":[{"id":"ADR-0023","surface":"adr"},{"id":"TSG-005","surface":"tsg"},{"id":"TSG-006","surface":"tsg"}],"concern_class":"design","disposition_status":"open","execution_status":"unplanned","finding_id":"RC12-F05","kind":"gap","non_claims":["Ownership design improvement is not runtime capability","Not an accepted requirement","Non-authoritative review projection"],"normalization_status":"source_verified","required_proof_class":"implementation","reviewer_severity":"critical","source_spans":[{"heading":"# 3. Что пока не закрыто","line_end":113,"line_start":85,"path":"doc/review/review-12-08-2026.md","quote_sha256":"c783b0b6eb8b3b1482cd5b825ade8411febe1e027c2a8970e1c2524bc0ab6e05"}],"summary":"Applicability ownership moved to neutral core (ADR-0023), but runtime and NormRule remain open","verification_status":"unverified"},{"candidate_targets":[{"id":"ADR-0009","surface":"adr"},{"id":"README.md","surface":"other"}],"concern_class":"docs","disposition_status":"open","execution_status":"unplanned","finding_id":"RC12-F17","kind":"defect","non_claims":["Not an accepted requirement","Not a runtime capability","Non-authoritative review projection"],"normalization_status":"source_verified","required_proof_class":"docs","reviewer_severity":"medium","source_spans":[{"heading":"## 4.1. README неверно пересказывает пять часов","line_end":311,"line_start":291,"path":"doc/review/review-12-08-2026.md","quote_sha256":"71453aee09416dedd642be97e243cd8026c43a3dc2fc8c8eafba91f7a1402175"}],"summary":"README misstates five-clock canonical names","verification_status":"unverified"},{"candidate_targets":[{"id":"ADR-0016","surface":"adr"},{"id":"ADR-0022","surface":"adr"}],"concern_class":"process","disposition_status":"open","execution_status":"unplanned","finding_id":"RC12-F18","kind":"defect","non_claims":["No verification or disposition has been recorded","Not a closed process defect","Non-authoritative review projection"],"normalization_status":"source_verified","required_proof_class":"docs","reviewer_severity":"medium","source_spans":[{"heading":"## 4.2. Активные ADR всё ещё ссылаются на отсутствующие основания","line_end":331,"line_start":313,"path":"doc/review/review-12-08-2026.md","quote_sha256":"3dcf60082ef4013b2d3203171d8a3897c25700d5d075392f03be35f5e75b50fd"}],"summary":"Active ADRs still cite missing foundations / local-only surfaces","verification_status":"unverified"},{"candidate_targets":[{"id":"prd/project-state/roadmap.md","surface":"roadmap"}],"concern_class":"process","disposition_status":"open","execution_status":"unplanned","finding_id":"RC12-F03","kind":"gap","non_claims":["Not an accepted requirement","Not a runtime capability","Non-authoritative review projection"],"normalization_status":"source_verified","required_proof_class":"process","reviewer_severity":"high","source_spans":[{"heading":"## 4.3. Roadmap всё ещё не является current-front планом","line_end":341,"line_start":333,"path":"doc/review/review-12-08-2026.md","quote_sha256":"37f4874de3e18f20e7407d7b3cb64442fcba0529ee5f8d0234ac116f368668c7"}],"summary":"Roadmap remains historical and is not a short active current-front plan","verification_status":"unverified"},{"candidate_targets":[{"id":"review-12-m166-m176-proposal","surface":"roadmap"}],"concern_class":"process","disposition_status":"open","execution_status":"unplanned","finding_id":"RC12-F19","kind":"roadmap_proposal","non_claims":["Roadmap proposal only; not adopted project plan","Does not create GSD milestones","Non-authoritative review projection"],"normalization_status":"source_verified","required_proof_class":"process","reviewer_severity":"high","source_spans":[{"heading":"# 7. Скорректированный roadmap после M165","line_end":639,"line_start":605,"path":"doc/review/review-12-08-2026.md","quote_sha256":"646073bfc5e34cc9d508c2ce17fc47be9c93328cffda2a7f05ac37400f1c2cb8"},{"heading":"# Итоговая рекомендация","line_end":746,"line_start":727,"path":"doc/review/review-12-08-2026.md","quote_sha256":"04b7b8dfd26fed51a5bc069320b23fc68a53925a1150b7ed60503ad97346f33b"}],"summary":"Proposed M166–M176 Ontology Requirements Baseline and follow-on sequence","verification_status":"unverified"}],"non_claims":["Non-authoritative review projection","Does not promote requirements, ADRs, roadmap, or lifecycle","Roadmap proposals remain proposals until separately adopted","Does not assert legal or runtime correctness"],"normalization":{"extractor_version":"review-case-delta-fixture/v1","method":"manual","source_hash":"83b0eacf6df840a24edfd98c444101c29b87bb1d59ef67c6f83398df42a3b1c6","status":"source_verified"},"packet_id":"RC-2026-08-12-001","schema_version":"review-case/v1","source":{"content_sha256":"83b0eacf6df840a24edfd98c444101c29b87bb1d59ef67c6f83398df42a3b1c6","path":"doc/review/review-12-08-2026.md","received_at":"2026-08-12T05:56:35Z","reviewed_git_revision":"1092ef435947d74080818f69dd08dbb27bfb8f9c","source_kind":"human_external"}}